{
  "$schema": "https://json-schema.org/draft/2020-12/schema",
  "$id": "https://helix-marketing-harness/strategy/strategic-brief.schema.json",
  "title": "strategic_brief — 上流戦略を下流戦術へ渡す唯一の契約。下流ループは有効な brief なしに開始できない",
  "type": "object",
  "required": [
    "id",
    "version",
    "strategic_choice_id",
    "segment_context_id",
    "value_hypothesis_id",
    "desired_recognition_change",
    "tactical_objective",
    "media_role",
    "message_hypothesis",
    "prohibited_patterns",
    "measurement_plan",
    "valid_from",
    "digest"
  ],
  "properties": {
    "id": {
      "type": "string",
      "pattern": "^SB-"
    },
    "version": {
      "type": "integer",
      "minimum": 1,
      "description": "版。上書きせず新版を作る（append-only）"
    },
    "strategic_choice_id": {
      "type": "string",
      "pattern": "^SC-"
    },
    "segment_context_id": {
      "type": "string",
      "pattern": "^SEG-"
    },
    "value_hypothesis_id": {
      "type": "string",
      "pattern": "^VH-"
    },
    "desired_recognition_change": {
      "type": "string",
      "description": "この brief が市場に起こす認識変化",
      "minLength": 8
    },
    "tactical_objective": {
      "type": "string",
      "description": "戦術目標（下流ループが学習する範囲）",
      "minLength": 1
    },
    "media_role": {
      "type": "string",
      "description": "媒体の戦略上の役割（media-roles.json 台帳の語彙。単なる媒体名は不可）",
      "minLength": 1
    },
    "message_hypothesis": {
      "type": "string",
      "description": "メッセージ仮説",
      "minLength": 1
    },
    "prohibited_patterns": {
      "type": "array",
      "items": {
        "type": "string"
      },
      "description": "禁止パターン（倫理線・ブランド線）"
    },
    "measurement_plan": {
      "type": "array",
      "minItems": 1,
      "uniqueItems": false,
      "items": {
        "type": "object",
        "required": [
          "observable"
        ],
        "additionalProperties": false,
        "properties": {
          "observable": {
            "type": "string",
            "minLength": 1
          },
          "success_signal": {
            "type": "string"
          },
          "target_hypothesis_ids": {
            "type": "array",
            "uniqueItems": true,
            "items": {
              "type": "string",
              "pattern": "^(VH|CA)-"
            }
          }
        }
      },
      "description": "計測計画（何を観測すれば仮説を判定できるか）。KPI 目標値の割当だけでは無効"
    },
    "valid_from": {
      "type": "string",
      "description": "有効開始（ISO 8601）",
      "minLength": 8,
      "pattern": "^\\d{4}-\\d{2}-\\d{2}([T ]\\d{2}:\\d{2}:\\d{2}(\\.\\d+)?(Z|[+-]\\d{2}:\\d{2}))?$"
    },
    "valid_until": {
      "type": [
        "string",
        "null"
      ],
      "description": "有効期限",
      "pattern": "^\\d{4}-\\d{2}-\\d{2}([T ]\\d{2}:\\d{2}:\\d{2}(\\.\\d+)?(Z|[+-]\\d{2}:\\d{2}))?$"
    },
    "digest": {
      "type": "string",
      "pattern": "^[0-9a-f]{64}$",
      "description": "brief 内容の正準化 JSON（キー昇順・区切り (\",\",\":\")・UTF-8/NFC。digest・status・created_at を算出対象から除外）の SHA-256。キー順・空白差で変化しない（AC-SR-01）"
    },
    "supersedes_id": {
      "type": [
        "string",
        "null"
      ],
      "description": "置換した旧版の ID。上流正本の変更は supersedes_id による append-only 新バージョンのみ"
    }
  },
  "additionalProperties": false
}
