{
  "id": "SB-FIX-1",
  "version": 1,
  "strategic_choice_id": "SC-FIX-1",
  "segment_context_id": "SEG-FIX-1",
  "value_hypothesis_id": "VH-FIX-1",
  "desired_recognition_change": "手動管理の隠れコストを問題として認識させる",
  "tactical_objective": "比較検討層の記事到達と読了",
  "media_role": "problem-framing",
  "message_hypothesis": "損失可視化の訴求が読了を伸ばす",
  "prohibited_patterns": [
    "恐怖訴求",
    "偽の希少性"
  ],
  "measurement_plan": [
    {
      "observable": "読了率",
      "success_signal": "損失可視化パートまでの読了が有意に増加",
      "target_hypothesis_ids": [
        "VH-FIX-1"
      ]
    },
    {
      "observable": "指名検索の増分"
    }
  ],
  "valid_from": "2026-08-01",
  "valid_until": null,
  "digest": "aaaaaaaaaaaaaaaaaaaaaaaaaaaaaaaaaaaaaaaaaaaaaaaaaaaaaaaaaaaaaaaa",
  "supersedes_id": null
}
